{
  "id": "EXT-001",
  "kind": "external_reference",
  "title": "FastAPI docs",
  "summary": "Official documentation for FastAPI",
  "source": "https://fastapi.tiangolo.com/",
  "source_type": "external",
  "confidence": "high",
  "priority": "medium",
  "requires_human_review": true,
  "created_at": "2026-05-18T01:23:45Z",
  "retrieved_at": "2026-05-18T01:23:45Z",
  "review_after": "2026-11-18T00:00:00Z"
}
